{
  "schemaVersion": 2,
  "edition": "game",
  "group": "ssial",
  "assets": [
    {
      "beforeSha256": "0dbfa3e2585f4c55c714cebe31418e4d93ccf4a3e13c30fc14fc7ede87183792",
      "value": {
        "assetId": "character:ssial-270C:front",
        "path": "src/game/art/characters/ssial-270C/front.webp",
        "kind": "character",
        "group": "ssial",
        "mime": "image/webp",
        "dimensions": {
          "width": 960,
          "height": 1440
        },
        "alphaRequired": true,
        "cardId": "ssial-270C",
        "side": "front",
        "family": "ssial",
        "legacy": {
          "mappingObject": "IMG",
          "key": "ssial-270C",
          "placeholder": "__S1__",
          "path": "src/img/ssial.jpg"
        },
        "status": "approved",
        "bytes": 144600,
        "sha256": "aebee99660fa579026a8c6f47ed9511ad63988c3f5d3fdc87da1f24af43ca14c",
        "masterPath": "docs/design/game-reviews/masters/character/ssial-270C/front.png",
        "masterSha256": "5a556be7ddc4acc35f72698ac2536b28a1dbd5bbadd74857eda9212a161c00e9",
        "reference": "docs/design/game-reference/cards.png",
        "reviewReceipt": "docs/design/game-reviews/ssial/ssial-270C-front-character-review.json",
        "ownerGroup": "ssial"
      }
    },
    {
      "beforeSha256": "f2561440d51306041052c82d011028edc30ba0bc77496975cd64975b3bba2d27",
      "value": {
        "assetId": "thumbnail:ssial-270C:front",
        "path": "src/game/art/thumbnails/ssial-270C/front.webp",
        "kind": "thumbnail",
        "group": "ssial",
        "mime": "image/webp",
        "dimensions": {
          "width": 144,
          "height": 216
        },
        "alphaRequired": false,
        "derivedFrom": "character:ssial-270C:front",
        "cardId": "ssial-270C",
        "side": "front",
        "status": "approved",
        "bytes": 10224,
        "sha256": "b68a8df40a1b4d57033b261e58640355f7d456aded0dc4e5df87150c45ab6837",
        "masterPath": "docs/design/game-reviews/masters/character/ssial-270C/front.png",
        "masterSha256": "5a556be7ddc4acc35f72698ac2536b28a1dbd5bbadd74857eda9212a161c00e9",
        "reference": "docs/design/game-reference/cards.png",
        "reviewReceipt": "docs/design/game-reviews/ssial/ssial-270C-front-thumbnail-review.json",
        "ownerGroup": "ssial"
      }
    },
    {
      "beforeSha256": "603fade042b57617a5ff53f88c46f1f05826e06835ecd1a8317bc8e161f9450a",
      "value": {
        "assetId": "character:ssial-270D:front",
        "path": "src/game/art/characters/ssial-270D/front.webp",
        "kind": "character",
        "group": "ssial",
        "mime": "image/webp",
        "dimensions": {
          "width": 960,
          "height": 1440
        },
        "alphaRequired": true,
        "cardId": "ssial-270D",
        "side": "front",
        "family": "ssial",
        "legacy": {
          "mappingObject": "IMG",
          "key": "ssial-270D",
          "placeholder": "__S2__",
          "path": "src/img/c_dq.jpg"
        },
        "status": "approved",
        "bytes": 158258,
        "sha256": "89c4b3bb07197b90876e065e849c70c255c6d08e0a766f070e73be1838e6b958",
        "masterPath": "docs/design/game-reviews/masters/character/ssial-270D/front.png",
        "masterSha256": "f308858dd71060bf221388f8c338fae33539d2d842dffa8978c1979e51df0e8b",
        "reference": "docs/design/game-reference/cards.png",
        "reviewReceipt": "docs/design/game-reviews/ssial/ssial-270D-front-character-review.json",
        "ownerGroup": "ssial"
      }
    },
    {
      "beforeSha256": "faf4c4daeef2d99147ebca1020b201324e8f7c33c45f3daabd6b02107ea6c6be",
      "value": {
        "assetId": "thumbnail:ssial-270D:front",
        "path": "src/game/art/thumbnails/ssial-270D/front.webp",
        "kind": "thumbnail",
        "group": "ssial",
        "mime": "image/webp",
        "dimensions": {
          "width": 144,
          "height": 216
        },
        "alphaRequired": false,
        "derivedFrom": "character:ssial-270D:front",
        "cardId": "ssial-270D",
        "side": "front",
        "status": "approved",
        "bytes": 9488,
        "sha256": "9177d0847e62add4d3dc8db01c416ed388a61d1ee7ae7bd6308c10617bc64ee4",
        "masterPath": "docs/design/game-reviews/masters/character/ssial-270D/front.png",
        "masterSha256": "f308858dd71060bf221388f8c338fae33539d2d842dffa8978c1979e51df0e8b",
        "reference": "docs/design/game-reference/cards.png",
        "reviewReceipt": "docs/design/game-reviews/ssial/ssial-270D-front-thumbnail-review.json",
        "ownerGroup": "ssial"
      }
    },
    {
      "beforeSha256": "5e4885920223f37068d4e317e844dd208fefb3266bfe4f31af47eaad7b7c6068",
      "value": {
        "assetId": "character:ssial-270E:front",
        "path": "src/game/art/characters/ssial-270E/front.webp",
        "kind": "character",
        "group": "ssial",
        "mime": "image/webp",
        "dimensions": {
          "width": 960,
          "height": 1440
        },
        "alphaRequired": true,
        "cardId": "ssial-270E",
        "side": "front",
        "family": "ssial",
        "legacy": {
          "mappingObject": "IMG",
          "key": "ssial-270E",
          "placeholder": "__S3__",
          "path": "src/img/c_ddq.jpg"
        },
        "status": "approved",
        "bytes": 135182,
        "sha256": "db07abb976ad34a281832dac64dd0d24c84445584f9251b673b3c0edf9d02a8f",
        "masterPath": "docs/design/game-reviews/masters/character/ssial-270E/front.png",
        "masterSha256": "52d996e7dc05157413dd56b24399554c769d2548decf67522e0e28449dfecbc8",
        "reference": "docs/design/game-reference/cards.png",
        "reviewReceipt": "docs/design/game-reviews/ssial/ssial-270E-front-character-review.json",
        "ownerGroup": "ssial"
      }
    },
    {
      "beforeSha256": "41090a9d62879c6bd4600d756b47d9d8c4fe46a30013c9ab54e2fbcd25e83f5b",
      "value": {
        "assetId": "thumbnail:ssial-270E:front",
        "path": "src/game/art/thumbnails/ssial-270E/front.webp",
        "kind": "thumbnail",
        "group": "ssial",
        "mime": "image/webp",
        "dimensions": {
          "width": 144,
          "height": 216
        },
        "alphaRequired": false,
        "derivedFrom": "character:ssial-270E:front",
        "cardId": "ssial-270E",
        "side": "front",
        "status": "approved",
        "bytes": 9312,
        "sha256": "4991a080db911e507912a46b3ae7d92e59dde4f92c7b2c6773336dc1e1a2ca14",
        "masterPath": "docs/design/game-reviews/masters/character/ssial-270E/front.png",
        "masterSha256": "52d996e7dc05157413dd56b24399554c769d2548decf67522e0e28449dfecbc8",
        "reference": "docs/design/game-reference/cards.png",
        "reviewReceipt": "docs/design/game-reviews/ssial/ssial-270E-front-thumbnail-review.json",
        "ownerGroup": "ssial"
      }
    },
    {
      "beforeSha256": "6a817d1bc7746699700878082076937e119ed78f911fc57ae348df4df2c022ed",
      "value": {
        "assetId": "character:ssial-270F:front",
        "path": "src/game/art/characters/ssial-270F/front.webp",
        "kind": "character",
        "group": "ssial",
        "mime": "image/webp",
        "dimensions": {
          "width": 960,
          "height": 1440
        },
        "alphaRequired": true,
        "cardId": "ssial-270F",
        "side": "front",
        "family": "ssial",
        "legacy": {
          "mappingObject": "IMG",
          "key": "ssial-270F",
          "placeholder": "__S4__",
          "path": "src/img/c_eddq.jpg"
        },
        "status": "approved",
        "bytes": 171796,
        "sha256": "0c418430290b14a7834eb9bf8e37a6f7912cf521f92dc1c1d61965663df42011",
        "masterPath": "docs/design/game-reviews/masters/character/ssial-270F/front.png",
        "masterSha256": "d83230b6e60c51683614b6b7503037a0059a855d660fd5939eb7f54b1afee84c",
        "reference": "docs/design/game-reference/cards.png",
        "reviewReceipt": "docs/design/game-reviews/ssial/ssial-270F-front-character-review.json",
        "ownerGroup": "ssial"
      }
    },
    {
      "beforeSha256": "c2cdc133ddb23d5fc803867dba95277cd23e69a95508952db1351cac32fb4c33",
      "value": {
        "assetId": "thumbnail:ssial-270F:front",
        "path": "src/game/art/thumbnails/ssial-270F/front.webp",
        "kind": "thumbnail",
        "group": "ssial",
        "mime": "image/webp",
        "dimensions": {
          "width": 144,
          "height": 216
        },
        "alphaRequired": false,
        "derivedFrom": "character:ssial-270F:front",
        "cardId": "ssial-270F",
        "side": "front",
        "status": "approved",
        "bytes": 11426,
        "sha256": "6216150a6eb157507152e40a5e4f04c7c7847ad5868555aaa65915f0c74856fb",
        "masterPath": "docs/design/game-reviews/masters/character/ssial-270F/front.png",
        "masterSha256": "d83230b6e60c51683614b6b7503037a0059a855d660fd5939eb7f54b1afee84c",
        "reference": "docs/design/game-reference/cards.png",
        "reviewReceipt": "docs/design/game-reviews/ssial/ssial-270F-front-thumbnail-review.json",
        "ownerGroup": "ssial"
      }
    },
    {
      "beforeSha256": "ddec63c0faf2a239f8f0cd08a7651cc2b34007fd9f0370da2aae382260b3defe",
      "value": {
        "assetId": "character:ssial-340W:front",
        "path": "src/game/art/characters/ssial-340W/front.webp",
        "kind": "character",
        "group": "ssial",
        "mime": "image/webp",
        "dimensions": {
          "width": 960,
          "height": 1440
        },
        "alphaRequired": true,
        "cardId": "ssial-340W",
        "side": "front",
        "family": "ssial",
        "legacy": {
          "mappingObject": "IMG",
          "key": "ssial-340W",
          "placeholder": "__S13__",
          "path": "src/img/c_340w.jpg"
        },
        "status": "approved",
        "bytes": 181492,
        "sha256": "8888a70ca8bc8a4df8771e9d73061e26ebf5de38ade21a37fea24169b84e4b19",